{
  "$schema": "https://json-schema.org/draft/2020-12/schema",
  "$id": "/data/gold-standards/schemas/gold-standard.schema.json",
  "title": "Gold Standard",
  "type": "object",
  "required": ["id", "name", "type", "version", "status", "owner", "description"],
  "properties": {
    "id": { "type": "string" },
    "name": { "type": "string" },
    "type": { "type": "string" },
    "version": { "type": "string" },
    "schema": { "type": "string" },
    "status": { "type": "string" },
    "runtimeStatus": { "type": "string" },
    "createdAt": { "type": "string" },
    "updatedAt": { "type": "string" },
    "owner": { "type": "string" },
    "source": { "type": "string" },
    "description": { "type": "string" },
    "mandatoryStructure": { "type": "array", "items": { "type": "string" } },
    "optionalStructure": { "type": "array", "items": { "type": "string" } },
    "mandatoryComponents": { "type": "array", "items": { "type": "string" } },
    "optionalComponents": { "type": "array", "items": { "type": "string" } },
    "mandatorySeo": { "type": "array", "items": { "type": "string" } },
    "mandatoryJsonLd": { "type": "array", "items": { "type": "string" } },
    "mandatoryTesting": { "type": "array", "items": { "type": "string" } },
    "mandatoryValidation": { "type": "array", "items": { "type": "string" } },
    "mandatoryPublishing": { "type": "array", "items": { "type": "string" } },
    "restrictions": { "type": "array", "items": { "type": "string" } },
    "acceptanceCriteria": { "type": "array", "items": { "type": "string" } },
    "migrationNotes": { "type": "array", "items": { "type": "string" } },
    "supersedes": { "type": ["string", "null"] },
    "supersededBy": { "type": ["string", "null"] },
    "availableVersions": { "type": "object" },
    "notes": { "type": "array", "items": { "type": "string" } }
  }
}
